max_job,total_students,mean_votes,ratio
אשכול תפקידי מקצועות המחשב_אשכול מקצועות המחשב,1365,0.16,0.71
אשכול תפקידי מבצעים ומודיעין_אשכול תפקידי חיל האו,1187,0.14,0.61
אשכול תפקידי מקצועות המחשב_חיילת מקצועות המחשוב,572,0.07,0.3
"הדרכה ופיקוד בכלל הזרועות_מדריכת סימולטור בחה""",434,0.05,0.22
אשכול תפקידי מקצועות המחשב_חיילת מקצועות התקשוב,244,0.03,0.13
הדרכה ופיקוד בכלל הזרועות_אשכול אימון גופני,245,0.03,0.13
הדרכה ופיקוד בכלל הזרועות_מדריכת חיל התקשוב,261,0.03,0.13
הדרכה ופיקוד בכלל הזרועות_מדריכת סימולטור בחיל,227,0.03,0.12
מסלול ייעודי לקצונה_קצינת תקשוב מערכתי,236,0.03,0.12
אשכול תפקידי רפואה_חובשת קדמית,177,0.02,0.09
אשכול תפקידי מבצעים ומודיעין_עובדת חדר מבצעים,181,0.02,0.09
אשכול אבחון כוח אדם_המערך הפסיכוטכני,157,0.02,0.08
אשכול תפקידי מבצעים ומודיעין_רכזת ביטחון מידע,158,0.02,0.08
אשכול תפקידי רפואה_פרמדיקית,132,0.02,0.07
אשכול תפקידי פקידות וסיוע_חיילת במשרד הביטחון,145,0.02,0.07
אשכול תפקידי פקידות וסיוע_שרטטת גרפיקאית,143,0.02,0.07
אשכול תפקידי חינוך הוראה והדרכה_אשכול תפקידי חונכות,126,0.02,0.07
אשכול אבחון כוח אדם_מאבחנת מדעי התנהגות,108,0.01,0.06
הדרכה ופיקוד בכלל הזרועות_מדריכת קרב מגע,122,0.01,0.06
מסלול ייעודי לקצונה_קצינת תקשוב קרבי (קש,115,0.01,0.06
תפקידי לחימה_באיזו מידה תרצי לשרת,107,0.01,0.06
אשכול תפקידי ארגון ומנהלה_מנהלה תעופה וסביבת,102,0.01,0.05
הדרכה ופיקוד בכלל הזרועות_מדריכת erp,92,0.01,0.05
הדרכה ופיקוד בכלל הזרועות_מדריכת אימונים קרביי,101,0.01,0.05
"הדרכה ופיקוד בכלל הזרועות_מדריכת יח""ש",106,0.01,0.05
הדרכה ופיקוד בכלל הזרועות_מפקדת כיתת טירונים,93,0.01,0.05
"אשכול דוברות וקישור_מש""קית קישור לכוחות",76,0.01,0.04
אשכול תפקידי מבצעים ומודיעין_בקרית שליטה ימית,73,0.01,0.04
אשכול תפקידי רפואה_מדריכת חיל הרפואה,64,0.01,0.03
הדרכה ופיקוד בכלל הזרועות_מדריכת הגנה אווירית,62,0.01,0.03
הדרכה ופיקוד בכלל הזרועות_מדריכת פיקוד העורף,51,0.01,0.03
"הדרכה ופיקוד בכלל הזרועות_מדריכת שו""ב",49,0.01,0.03
מסלול ייעודי לקצונה_קצינה בחיל הטכנולוגי,55,0.01,0.03
תפקידי לחימה_לוחמת ימית,56,0.01,0.03
"אשכול מקצועות טכניים טכנולוגיים_מפעילת קש""ב טקטי",60,0.01,0.03
אשכול מקצועות טכניים טכנולוגיים_המערך הטכני בחיל הטכ,30,0.0,0.02
אשכול תפקידי פקידות וסיוע_רשמת משפטית,38,0.0,0.02
אשכול תפקידי רפואה_סייעת רופא שיניים,40,0.0,0.02
הדרכה ופיקוד בכלל הזרועות_מדריכה בחיל הטכנולוג,35,0.0,0.02
"אשכול תפקידי שיטור_חיילת משטרה (שח""ם)",44,0.01,0.02
אשכול תפקידי חינוך הוראה והדרכה_מורה חיילת,37,0.0,0.02
הדרכה ופיקוד בכלל הזרועות_חונכת מקצועית,38,0.0,0.02
אשכול תפקידי ניהול משאבי אנוש_רכזת מידע,40,0.0,0.02
"אשכול תפקידי ניהול משאבי אנוש_מש""קית משא""ן סדיר",41,0.0,0.02
אשכול מקצועות טכניים טכנולוגיים_מנוענית/ימאית,39,0.0,0.02
אשכול תפקידי שיטור_לוחמת מעברים,14,0.0,0.01
אשכול תפקידי שיטור_אבטחת אישים בכירים,14,0.0,0.01
"אשכול תפקידי פקידות וסיוע_מש""קית מתנדבים",18,0.0,0.01
"אשכול תפקידי רפואה_מש""קית שירותי רפואה",19,0.0,0.01
אשכול תפקידי רפואה_עובדת מעבדה רפואית,28,0.0,0.01
אשכול תפקידי שיטור_חיילת בשירות בתי הסו,15,0.0,0.01
אשכול תפקידי שיטור_סיירת משמר הגבול (מג,12,0.0,0.01
"אשכול תפקידי פקידות וסיוע_מש""קית מטה",16,0.0,0.01
אשכול מקצועות טכניים טכנולוגיים_המערך הטכני בחיל האו,11,0.0,0.01
אשכול תפקידי לוגיסטיקה ואחזקה_טכנאית אופטית,20,0.0,0.01
אשכול תפקידי שיטור_שוטרת צבאית,16,0.0,0.01
"אשכול תפקידי ניהול משאבי אנוש_מש""קית משא""ן מילואים",10,0.0,0.01
אשכול תפקידי ארגון ומנהלה_טכנאית אופטית,17,0.0,0.01
"אשכול תפקידי לוגיסטיקה ואחזקה_מש""קית לוגיסטיקה",14,0.0,0.01
אשכול תפקידי מבצעים ומודיעין_תצפיתנית בחיל האיסוף,19,0.0,0.01
תפקידי לחימה_חובלים,25,0.0,0.01
אשכול תפקידי מבצעים ומודיעין_חוקרת מודיעין ימי,10,0.0,0.01
אשכול תפקידי חינוך הוראה והדרכה_מדריכת נוער בסיס,25,0.0,0.01
אשכול מקצועות תקשורת_המערך הטכני בחיל האו,8,0.0,0.0
אשכול תפקידי ארגון ומנהלה_בוחנת תחמושת,5,0.0,0.0
"אשכול מקצועות טכניים טכנולוגיים_מיזמי אלקטרוניקה (ח""",7,0.0,0.0
אשכול מקצועות תקשורת_אחראית תקשורת ימית מ,3,0.0,0.0
אשכול תפקידי ארגון ומנהלה_מאבטחת מתקנים,2,0.0,0.0
הדרכה ופיקוד בכלל הזרועות_מדריכת שר-אל,9,0.0,0.0
מסלול ייעודי לקצונה_קצינת מנהלה בחיל האו,4,0.0,0.0
מסלול ייעודי לקצונה_קצינת פיקוד העורף,3,0.0,0.0
מסלול ייעודי לקצונה_קצינת שלישות בחיל מש,1,0.0,0.0
אשכול דוברות וקישור_נציגת שירות,2,0.0,0.0
"אשכול דוברות וקישור_מש""קית דוברות",3,0.0,0.0
"אשכול אבחון כוח אדם_מראיינת גחל""ת",1,0.0,0.0
הדרכה ופיקוד בכלל הזרועות_מדריכת חיל הלוגיסטיק,8,0.0,0.0
אשכול תפקידי מבצעים ומודיעין_בקרית איסוף קרבי (שח,6,0.0,0.0
אשכול תפקידי ארגון ומנהלה_מערך המנהלה בחיל המו,1,0.0,0.0
אשכול תפקידי ארגון ומנהלה_נהגת בטחון שוטף,9,0.0,0.0
אשכול תפקידי לוגיסטיקה ואחזקה_נהגת בטחון שוטף,4,0.0,0.0
אשכול תפקידי לוגיסטיקה ואחזקה_משגיחת כשרות,2,0.0,0.0
אשכול תפקידי לוגיסטיקה ואחזקה_מאחזקת נשק קל,5,0.0,0.0
אשכול תפקידי לוגיסטיקה ואחזקה_מאחזקת מצנחים,2,0.0,0.0
"אשכול תפקידי ניהול משאבי אנוש_מש""קית תכנון כ""א",1,0.0,0.0
"אשכול תפקידי ניהול משאבי אנוש_רכזת ג""ל (גיוס לצה""ל",1,0.0,0.0
אשכול תפקידי ניהול משאבי אנוש_רכזת תנאי שירות,5,0.0,0.0
אשכול תפקידי לוגיסטיקה ואחזקה_בוחנת תחמושת,3,0.0,0.0
אשכול תפקידי פקידות וסיוע_נציגת שירות,2,0.0,0.0
אשכול תפקידי פקידות וסיוע_פקידה,5,0.0,0.0
אשכול תפקידי פקידות וסיוע_פקידת לשכה (מזכירה),1,0.0,0.0
אשכול תפקידי לוגיסטיקה ואחזקה_בודקת ציוד אלקטרוניק,8,0.0,0.0
אשכול תפקידי רפואה_חובשת,1,0.0,0.0
אשכול תפקידי לוגיסטיקה ואחזקה_אחראית ניהול מלאי,6,0.0,0.0
אשכול תפקידי לוגיסטיקה ואחזקה_ספקית אגף הטכנולוגיה,1,0.0,0.0
אשכול תפקידי שיטור_רכזת מודיעין וחקירות,9,0.0,0.0
אשכול תפקידי ארגון ומנהלה_נהגת רכב קל,7,0.0,0.0
אשכול תפקידי ניהול משאבי אנוש_רכזת פניות ציבור,3,0.0,0.0
